{"$schema":"https://json-schema.org/draft/2020-12/schema","$id":"https://axignal.com/schemas/foundational-library-runtime.schema.json","title":"AXIGNAL Foundational Library Runtime Registry","type":"object","additionalProperties":false,"required":["schema_version","task_id","programme_version","status","human_authorised_branch_start","canonical_activation_authorised","dependency_status","authority_model","common_record_envelope","rights_dimensions","cross_library_contract","libraries","observability","acceptance_gate"],"properties":{"schema_version":{"const":"axignal.foundational-library-runtime/v0.1"},"task_id":{"const":"AX-GE2E-P05-T01"},"programme_version":{"const":"1.4.0"},"status":{"const":"DRAFT_ENGINEERING_FOUNDATION"},"human_authorised_branch_start":{"const":true},"canonical_activation_authorised":{"const":false},"dependency_status":{"type":"object","required":["p04_task","p04_engineering_head","p04_engineering_evidence_ready","p04_canonical_activation_authorised","p03_canonical_activation_authorised","p02_canonical_activation_authorised","p01_dependency_satisfied","stacked_base_branch","merge_to_main_allowed"],"additionalProperties":false,"properties":{"p04_task":{"const":"AX-GE2E-P04-T01"},"p04_engineering_head":{"pattern":"^[0-9a-f]{40}$"},"p04_engineering_evidence_ready":{"const":true},"p04_canonical_activation_authorised":{"const":false},"p03_canonical_activation_authorised":{"const":false},"p02_canonical_activation_authorised":{"const":false},"p01_dependency_satisfied":{"const":false},"stacked_base_branch":{"const":"agent/ax-ge2e-p04-source-admission-factory-v1.4"},"merge_to_main_allowed":{"const":false}}},"authority_model":{"type":"object","required":["candidate_write_authority","canonical_write_authority","browser_authority","model_authority","connector_authority","worker_authority","default_decision","rules"],"additionalProperties":false,"properties":{"candidate_write_authority":{"type":"array","minItems":1,"uniqueItems":true,"items":{"type":"string"}},"canonical_write_authority":{"type":"array","minItems":2,"uniqueItems":true,"items":{"type":"string"}},"browser_authority":{"const":"ZERO"},"model_authority":{"const":"PROPOSAL_ONLY"},"connector_authority":{"const":"CANDIDATE_ONLY"},"worker_authority":{"const":"BOUNDED_CANDIDATE_MUTATION"},"default_decision":{"const":"DENY"},"rules":{"type":"array","minItems":5,"items":{"type":"string"}}}},"common_record_envelope":{"type":"object","required":["required_fields","authority_states","common_operations","common_events","lineage_requirements","bitemporal_requirements","rules"],"additionalProperties":false,"properties":{"required_fields":{"type":"array","minItems":15,"uniqueItems":true,"items":{"type":"string"}},"authority_states":{"type":"array","minItems":6,"uniqueItems":true,"items":{"type":"string"}},"common_operations":{"type":"array","minItems":8,"uniqueItems":true,"items":{"type":"string"}},"common_events":{"type":"array","minItems":6,"uniqueItems":true,"items":{"type":"string"}},"lineage_requirements":{"type":"array","minItems":7,"uniqueItems":true,"items":{"type":"string"}},"bitemporal_requirements":{"type":"array","minItems":4,"uniqueItems":true,"items":{"type":"string"}},"rules":{"type":"array","minItems":5,"items":{"type":"string"}}}},"rights_dimensions":{"type":"array","minItems":10,"maxItems":10,"uniqueItems":true,"items":{"type":"string"}},"cross_library_contract":{"type":"object","required":["reference_form","join_rules","dependency_order"],"additionalProperties":false,"properties":{"reference_form":{"type":"object","required":["required"],"additionalProperties":false,"properties":{"required":{"type":"array","minItems":5,"uniqueItems":true,"items":{"type":"string"}}}},"join_rules":{"type":"array","minItems":7,"items":{"type":"string"}},"dependency_order":{"type":"array","minItems":7,"maxItems":7,"uniqueItems":true,"items":{"pattern":"^AX-LIB-F0[1-7]$"}}}},"libraries":{"type":"array","minItems":7,"maxItems":7,"items":{"$ref":"#/$defs/library"}},"observability":{"type":"object","required":["metrics","alerts"],"additionalProperties":false,"properties":{"metrics":{"type":"array","minItems":8,"uniqueItems":true,"items":{"type":"string"}},"alerts":{"type":"array","minItems":8,"uniqueItems":true,"items":{"type":"string"}}}},"acceptance_gate":{"type":"object","required":["required_before_canonical_activation","current_decision"],"additionalProperties":false,"properties":{"required_before_canonical_activation":{"type":"array","minItems":14,"items":{"type":"string"}},"current_decision":{"const":"NOT_READY_FOR_CANONICAL_ACTIVATION"}}}},"$defs":{"library":{"type":"object","additionalProperties":false,"required":["library_id","canonical_name","service_id","record_types","identifier_schemes","commands","queries","domain_invariants","indexes","resolution","version","implementation_state","p02_contract_ref","record_envelope_ref","authority_model_ref","persistence","conformance_requirements"],"properties":{"library_id":{"pattern":"^AX-LIB-F0[1-7]$"},"canonical_name":{"type":"string","minLength":3},"service_id":{"pattern":"^[a-z][a-z0-9_]+$"},"record_types":{"type":"array","minItems":6,"uniqueItems":true,"items":{"type":"string"}},"identifier_schemes":{"type":"array","minItems":4,"uniqueItems":true,"items":{"type":"string"}},"commands":{"type":"array","minItems":4,"uniqueItems":true,"items":{"type":"string"}},"queries":{"type":"array","minItems":4,"uniqueItems":true,"items":{"type":"string"}},"domain_invariants":{"type":"array","minItems":6,"items":{"type":"string"}},"indexes":{"type":"array","minItems":4,"uniqueItems":true,"items":{"type":"string"}},"resolution":{"type":"string","minLength":20},"version":{"const":"0.1.0"},"implementation_state":{"const":"REFERENCE_IMPLEMENTATION"},"p02_contract_ref":{"type":"string","pattern":"library-contracts\\.v0\\.1\\.json#AX-LIB-F0[1-7]$"},"record_envelope_ref":{"const":"#/common_record_envelope"},"authority_model_ref":{"const":"#/authority_model"},"persistence":{"type":"object","required":["candidate_store","admitted_store","history","deletion","cache"],"additionalProperties":false,"properties":{"candidate_store":{"const":"TENANT_SCOPED_RLS"},"admitted_store":{"const":"GLOBAL_APPEND_ONLY_LEDGER"},"history":{"const":"BITEMPORAL_SUPERSESSION"},"deletion":{"const":"TOMBSTONE_AND_PROPAGATION"},"cache":{"const":"VERSION_PINNED_INVALIDATED_ON_REVOCATION"}}},"conformance_requirements":{"type":"array","minItems":7,"uniqueItems":true,"items":{"type":"string"}}}}}}
