{"schema_version":"axignal.foundational-library-runtime/v0.1","task_id":"AX-GE2E-P05-T01","programme_version":"1.4.0","status":"DRAFT_ENGINEERING_FOUNDATION","human_authorised_branch_start":true,"canonical_activation_authorised":false,"dependency_status":{"p04_task":"AX-GE2E-P04-T01","p04_engineering_head":"2977a6cd4056969313cf7356070eedf6f7d85ed0","p04_engineering_evidence_ready":true,"p04_canonical_activation_authorised":false,"p03_canonical_activation_authorised":false,"p02_canonical_activation_authorised":false,"p01_dependency_satisfied":false,"stacked_base_branch":"agent/ax-ge2e-p04-source-admission-factory-v1.4","merge_to_main_allowed":false},"authority_model":{"candidate_write_authority":["FOUNDATION_PROPOSAL_STORE"],"canonical_write_authority":["INDEPENDENT_ADMISSION_RUNTIME","HUMAN_DATA_AUTHORITY"],"browser_authority":"ZERO","model_authority":"PROPOSAL_ONLY","connector_authority":"CANDIDATE_ONLY","worker_authority":"BOUNDED_CANDIDATE_MUTATION","default_decision":"DENY","rules":["No source, connector, parser, model, browser or tenant workspace can directly mutate admitted foundation records.","Admission requires version-pinned evidence, rights, classification, policy and human decision.","Unknown, ambiguous, conflicting or stale inputs preserve uncertainty and cannot be coerced into canonical values.","Revocation, supersession and kill switches take precedence over cached resolution.","Every admitted change is append-only, reversible and explainable."]},"common_record_envelope":{"required_fields":["object_id","library_id","object_type","schema_version","authority_state","source_refs","rights_snapshot_refs","observed_at","recorded_at","valid_from","valid_to","jurisdiction_refs","language_tag","classification","payload_hash","supersedes_ref"],"authority_states":["CANDIDATE","REVIEWED","ADMITTED","CONTESTED","SUPERSEDED","REVOKED"],"common_operations":["validate","propose","review","admit","supersede","revoke","resolve_at","explain_lineage"],"common_events":["OBJECT_PROPOSED","OBJECT_REVIEWED","OBJECT_ADMITTED","OBJECT_CONTESTED","OBJECT_SUPERSEDED","OBJECT_REVOKED"],"lineage_requirements":["source_ref","source_version","parser_version","transformation_chain","rights_snapshot_ref","policy_version","decision_ref"],"bitemporal_requirements":["valid_from","valid_to","recorded_at","supersedes_ref"],"rules":["Object identifiers are opaque and immutable.","Payload hash covers canonical serialization and excludes volatile transport metadata.","Candidate and admitted stores are physically and logically separated.","History is preserved through supersession; destructive update is forbidden.","Foreign references are version-pinned or resolved at an explicit time."]},"rights_dimensions":["collection","transient_processing","persistent_storage","model_input","derived_calculations","internal_display","customer_display","export","api_redistribution","model_training_or_evaluation"],"cross_library_contract":{"reference_form":{"required":["target_library_id","target_object_id","target_schema_version","resolution_time","authority_state"]},"join_rules":["Cross-library joins preserve each record's jurisdiction, temporal, language, rights and document lineage.","A join cannot upgrade the least-authoritative input.","A revoked rights snapshot contributes zero materialized content.","A contested entity or taxonomy mapping remains contested in derived views.","Document anchors remain bound to exact document versions.","Translation never replaces source-native text.","Currency or unit normalization requires explicit method and temporal context."],"dependency_order":["AX-LIB-F01","AX-LIB-F02","AX-LIB-F03","AX-LIB-F04","AX-LIB-F05","AX-LIB-F06","AX-LIB-F07"]},"libraries":[{"library_id":"AX-LIB-F01","canonical_name":"Jurisdiction and geography","service_id":"jurisdiction_resolver","record_types":["Jurisdiction","Place","AdministrativeArea","Region","Country","GeoBoundary"],"identifier_schemes":["ISO_3166_1_ALPHA2","ISO_3166_1_ALPHA3","ISO_3166_2","UN_M49","NUTS","SOURCE_NATIVE"],"commands":["propose_jurisdiction","propose_boundary_revision","propose_code_mapping","contest_scope"],"queries":["resolve_jurisdiction_at","list_ancestors_at","list_descendants_at","explain_boundary_lineage"],"domain_invariants":["A jurisdiction code is interpreted only with scheme, publisher, version and validity interval.","Disputed or overlapping boundaries remain explicit and cannot be silently collapsed.","Geometry is referenced by immutable content hash; coordinates are never inferred from labels.","Successor and predecessor relations preserve temporal direction.","Country, jurisdiction, place and administrative area are distinct object types.","Unknown jurisdiction is not replaced with tenant, source or user locale."],"indexes":["scheme+code+valid_interval","parent_ref+valid_interval","geometry_hash","source_ref"],"resolution":"Return zero, one or many scoped candidates; ambiguity is a first-class result.","version":"0.1.0","implementation_state":"REFERENCE_IMPLEMENTATION","p02_contract_ref":"data/ontology/library-contracts.v0.1.json#AX-LIB-F01","record_envelope_ref":"#/common_record_envelope","authority_model_ref":"#/authority_model","persistence":{"candidate_store":"TENANT_SCOPED_RLS","admitted_store":"GLOBAL_APPEND_ONLY_LEDGER","history":"BITEMPORAL_SUPERSESSION","deletion":"TOMBSTONE_AND_PROPAGATION","cache":"VERSION_PINNED_INVALIDATED_ON_REVOCATION"},"conformance_requirements":["SCHEMA_VALID","CANDIDATE_CANONICAL_ISOLATION","RIGHTS_FAIL_CLOSED","TEMPORAL_LINEAGE","REVERSIBLE_CHANGE","NO_AI_ADMISSION_BYPASS","AX-LIB-F01_DOMAIN_SEMANTICS"]},{"library_id":"AX-LIB-F02","canonical_name":"Entities, organisations and ownership","service_id":"entity_resolution_service","record_types":["Organisation","PublicBody","Company","Person","OwnershipInterest","Identifier"],"identifier_schemes":["LEI","VAT_ID","COMPANY_REGISTER_ID","PUBLIC_BODY_ID","SOURCE_NATIVE"],"commands":["propose_entity","propose_match","review_match","split_entity","record_ownership"],"queries":["resolve_identifier_at","get_entity_graph_at","explain_match","get_ownership_at"],"domain_invariants":["Candidate matches never mutate or merge canonical entities.","Every merge decision records evidence, reviewer, policy version and reversible merge set.","Entity split restores prior identifiers, relations and lineage without information loss.","Observed ownership and inferred control are distinct assertions.","Ownership percentage, class, directness and validity interval are independently represented.","Person records default to restricted and require explicit processing authority."],"indexes":["scheme+identifier+jurisdiction","normalized_name+jurisdiction","ownership_subject+valid_interval","merge_set_id"],"resolution":"Probabilistic candidates are proposals; admission requires deterministic policy and human authority.","version":"0.1.0","implementation_state":"REFERENCE_IMPLEMENTATION","p02_contract_ref":"data/ontology/library-contracts.v0.1.json#AX-LIB-F02","record_envelope_ref":"#/common_record_envelope","authority_model_ref":"#/authority_model","persistence":{"candidate_store":"TENANT_SCOPED_RLS","admitted_store":"GLOBAL_APPEND_ONLY_LEDGER","history":"BITEMPORAL_SUPERSESSION","deletion":"TOMBSTONE_AND_PROPAGATION","cache":"VERSION_PINNED_INVALIDATED_ON_REVOCATION"},"conformance_requirements":["SCHEMA_VALID","CANDIDATE_CANONICAL_ISOLATION","RIGHTS_FAIL_CLOSED","TEMPORAL_LINEAGE","REVERSIBLE_CHANGE","NO_AI_ADMISSION_BYPASS","AX-LIB-F02_DOMAIN_SEMANTICS"]},{"library_id":"AX-LIB-F03","canonical_name":"Taxonomies and classifications","service_id":"taxonomy_service","record_types":["Taxonomy","TaxonomyVersion","Concept","Label","Crosswalk","MappingAssertion"],"identifier_schemes":["CPV","NUTS","NAICS","PSC","NACE","ISIC","HS","SITC","CPC","SOURCE_NATIVE"],"commands":["register_taxonomy_version","propose_concept","retire_concept","propose_crosswalk","review_crosswalk"],"queries":["resolve_concept_at","list_hierarchy_at","map_concepts_at","explain_crosswalk"],"domain_invariants":["Every concept belongs to an immutable taxonomy version.","Source-native codes and labels are preserved verbatim beside normalized representations.","Crosswalk cardinality may be one-to-many or many-to-many.","Equivalence, broader, narrower and related mappings remain distinct.","Mapping confidence never converts a proposal into an admitted mapping.","Retired concepts remain resolvable for historical records."],"indexes":["taxonomy+version+concept_code","parent_concept_ref","source_concept+target_taxonomy_version","mapping_status"],"resolution":"Mappings return all applicable assertions with scope, method, confidence and lineage.","version":"0.1.0","implementation_state":"REFERENCE_IMPLEMENTATION","p02_contract_ref":"data/ontology/library-contracts.v0.1.json#AX-LIB-F03","record_envelope_ref":"#/common_record_envelope","authority_model_ref":"#/authority_model","persistence":{"candidate_store":"TENANT_SCOPED_RLS","admitted_store":"GLOBAL_APPEND_ONLY_LEDGER","history":"BITEMPORAL_SUPERSESSION","deletion":"TOMBSTONE_AND_PROPAGATION","cache":"VERSION_PINNED_INVALIDATED_ON_REVOCATION"},"conformance_requirements":["SCHEMA_VALID","CANDIDATE_CANONICAL_ISOLATION","RIGHTS_FAIL_CLOSED","TEMPORAL_LINEAGE","REVERSIBLE_CHANGE","NO_AI_ADMISSION_BYPASS","AX-LIB-F03_DOMAIN_SEMANTICS"]},{"library_id":"AX-LIB-F04","canonical_name":"Time, currency, value and units","service_id":"time_value_service","record_types":["TimeInstant","TimeInterval","Currency","MonetaryValue","Unit","Quantity","ConversionRate"],"identifier_schemes":["ISO_4217","UCUM","IANA_TZ","ISO_8601","SOURCE_NATIVE"],"commands":["record_time","record_value","record_rate","restate_value","revise_vintage"],"queries":["resolve_value_at","convert_value_at","resolve_interval","explain_restated_value"],"domain_invariants":["Published, retrieved, observed, event, valid, effective, revised, vintage and recorded times are distinct axes.","Missing time, timezone or calendar remains unknown